model/xgb_experiment_20260623_195503_metrics.json

[
  {
    "timestamp": "2026-06-23T20:03:50.547550",
    "metrics": {
      "train_accuracy": 0.8182248520710059,
      "train_auc": 0.9170587633464231,
      "train_f1": 0.7221418234442837,
      "val_accuracy": 0.7565649396735273,
      "val_auc": 0.8457929680436074,
      "val_f1": 0.6307857911733046,
      "test_accuracy": 0.7679205110007097,
      "test_auc": 0.8591852024077089,
      "test_f1": 0.6464864864864864,
      "confusion_matrix_test": "[[783 252]\n [ 75 299]]",
      "classification_report": {
        "0": {
          "precision": 0.9125874125874126,
          "recall": 0.7565217391304347,
          "f1-score": 0.8272583201267829,
          "support": 1035.0
        },
        "1": {
          "precision": 0.542649727767695,
          "recall": 0.7994652406417112,
          "f1-score": 0.6464864864864864,
          "support": 374.0
        },
        "accuracy": 0.7679205110007097,
        "macro avg": {
          "precision": 0.7276185701775538,
          "recall": 0.777993489886073,
          "f1-score": 0.7368724033066347,
          "support": 1409.0
        },
        "weighted avg": {
          "precision": 0.8143924557935344,
          "recall": 0.7679205110007097,
          "f1-score": 0.7792748809632124,
          "support": 1409.0
        }
      },
      "model": "XGBClassifier(base_score=None, booster=None, callbacks=None,\n              colsample_bylevel=None, colsample_bynode=None,\n              colsample_bytree=0.7, device='cuda', early_stopping_rounds=50,\n              enable_categorical=False, eval_metric=['auc', 'error', 'logloss'],\n              feature_types=None, feature_weights=None, gamma=0.05,\n              grow_policy='lossguide', importance_type=None,\n              interaction_constraints=None, learning_rate=0.01, max_bin=256,\n              max_cat_threshold=None, max_cat_to_onehot=None,\n              max_delta_step=None, max_depth=6, max_leaves=32,\n              min_child_weight=5, missing=nan, monotone_constraints=None,\n              multi_strategy=None, n_estimators=500, n_jobs=1,\n              num_parallel_tree=None, ...)",
      "feature_names": [
        "customerID",
        "gender",
        "SeniorCitizen",
        "Partner",
        "Dependents",
        "tenure",
        "PhoneService",
        "MultipleLines",
        "InternetService",
        "OnlineSecurity",
        "OnlineBackup",
        "DeviceProtection",
        "TechSupport",
        "StreamingTV",
        "StreamingMovies",
        "Contract",
        "PaperlessBilling",
        "PaymentMethod",
        "MonthlyCharges",
        "TotalCharges",
        "tenure_group",
        "tenure_to_max",
        "tenure_monthly_ratio",
        "charge_group",
        "total_services",
        "has_internet",
        "has_phone",
        "is_month_to_month",
        "is_automatic_payment",
        "is_senior",
        "has_dependents",
        "churn_risk_score",
        "SeniorCitizen_zscore",
        "tenure_zscore",
        "MonthlyCharges_zscore",
        "TotalCharges_zscore"
      ],
      "fpr": "[0.00000000e+00 0.00000000e+00 0.00000000e+00 9.66183575e-04\n 9.66183575e-04 1.93236715e-03 1.93236715e-03 2.89855072e-03\n 2.89855072e-03 3.86473430e-03 3.86473430e-03 4.83091787e-03\n 4.83091787e-03 5.79710145e-03 5.79710145e-03 6.76328502e-03\n 6.76328502e-03 8.69565217e-03 8.69565217e-03 9.66183575e-03\n 9.66183575e-03 1.06280193e-02 1.06280193e-02 1.15942029e-02\n 1.15942029e-02 1.35265700e-02 1.35265700e-02 1.54589372e-02\n 1.54589372e-02 1.73913043e-02 1.73913043e-02 1.83574879e-02\n 1.83574879e-02 2.12560386e-02 2.12560386e-02 2.41545894e-02\n 2.41545894e-02 2.51207729e-02 2.51207729e-02 2.80193237e-02\n 2.80193237e-02 2.99516908e-02 2.99516908e-02 3.09178744e-02\n 3.09178744e-02 3.18840580e-02 3.18840580e-02 3.28502415e-02\n 3.28502415e-02 3.38164251e-02 3.38164251e-02 3.47826087e-02\n 3.47826087e-02 3.67149758e-02 3.67149758e-02 4.15458937e-02\n 4.15458937e-02 4.54106280e-02 4.54106280e-02 4.63768116e-02\n 4.63768116e-02 4.92753623e-02 4.92753623e-02 5.12077295e-02\n 5.12077295e-02 5.21739130e-02 5.21739130e-02 5.31400966e-02\n 5.31400966e-02 5.41062802e-02 5.41062802e-02 5.50724638e-02\n 5.50724638e-02 5.60386473e-02 5.60386473e-02 5.79710145e-02\n 5.79710145e-02 5.89371981e-02 5.89371981e-02 6.08695652e-02\n 6.08695652e-02 6.37681159e-02 6.37681159e-02 6.57004831e-02\n 6.57004831e-02 6.85990338e-02 6.85990338e-02 7.14975845e-02\n 7.14975845e-02 7.24637681e-02 7.24637681e-02 7.34299517e-02\n 7.34299517e-02 7.43961353e-02 7.43961353e-02 7.63285024e-02\n 7.63285024e-02 7.72946860e-02 7.72946860e-02 7.82608696e-02\n 7.82608696e-02 8.01932367e-02 8.01932367e-02 8.30917874e-02\n 8.30917874e-02 8.40579710e-02 8.40579710e-02 8.50241546e-02\n 8.50241546e-02 8.79227053e-02 8.79227053e-02 8.88888889e-02\n 8.88888889e-02 9.08212560e-02 9.08212560e-02 9.37198068e-02\n 9.37198068e-02 9.46859903e-02 9.46859903e-02 9.56521739e-02\n 9.56521739e-02 9.75845411e-02 9.75845411e-02 9.85507246e-02\n 9.85507246e-02 1.00483092e-01 1.00483092e-01 1.01449275e-01\n 1.01449275e-01 1.05314010e-01 1.05314010e-01 1.06280193e-01\n 1.06280193e-01 1.07246377e-01 1.07246377e-01 1.09178744e-01\n 1.09178744e-01 1.11111111e-01 1.11111111e-01 1.12077295e-01\n 1.12077295e-01 1.13043478e-01 1.13043478e-01 1.21739130e-01\n 1.21739130e-01 1.22705314e-01 1.22705314e-01 1.24637681e-01\n 1.24637681e-01 1.25603865e-01 1.25603865e-01 1.29468599e-01\n 1.29468599e-01 1.30434783e-01 1.30434783e-01 1.32367150e-01\n 1.32367150e-01 1.33333333e-01 1.33333333e-01 1.34299517e-01\n 1.34299517e-01 1.36231884e-01 1.36231884e-01 1.37198068e-01\n 1.37198068e-01 1.48792271e-01 1.48792271e-01 1.49758454e-01\n 1.49758454e-01 1.51690821e-01 1.51690821e-01 1.52657005e-01\n 1.52657005e-01 1.53623188e-01 1.53623188e-01 1.54589372e-01\n 1.54589372e-01 1.59420290e-01 1.59420290e-01 1.60386473e-01\n 1.60386473e-01 1.61352657e-01 1.61352657e-01 1.63285024e-01\n 1.63285024e-01 1.65217391e-01 1.65217391e-01 1.77777778e-01\n 1.77777778e-01 1.81642512e-01 1.81642512e-01 1.83574879e-01\n 1.83574879e-01 1.88405797e-01 1.88405797e-01 1.89371981e-01\n 1.89371981e-01 1.90338164e-01 1.90338164e-01 1.92270531e-01\n 1.92270531e-01 1.94202899e-01 1.94202899e-01 1.97101449e-01\n 1.97101449e-01 2.02898551e-01 2.02898551e-01 2.03864734e-01\n 2.03864734e-01 2.09661836e-01 2.09661836e-01 2.10628019e-01\n 2.10628019e-01 2.20289855e-01 2.20289855e-01 2.22222222e-01\n 2.22222222e-01 2.25120773e-01 2.25120773e-01 2.28019324e-01\n 2.28019324e-01 2.29951691e-01 2.29951691e-01 2.31884058e-01\n 2.31884058e-01 2.32850242e-01 2.32850242e-01 2.34782609e-01\n 2.34782609e-01 2.36714976e-01 2.36714976e-01 2.38647343e-01\n 2.38647343e-01 2.39613527e-01 2.39613527e-01 2.41545894e-01\n 2.41545894e-01 2.42512077e-01 2.42512077e-01 2.43478261e-01\n 2.43478261e-01 2.55072464e-01 2.55072464e-01 2.60869565e-01\n 2.60869565e-01 2.63768116e-01 2.63768116e-01 2.67632850e-01\n 2.67632850e-01 2.69565217e-01 2.69565217e-01 2.74396135e-01\n 2.74396135e-01 2.85990338e-01 2.85990338e-01 2.86956522e-01\n 2.86956522e-01 2.93719807e-01 2.93719807e-01 2.99516908e-01\n 2.99516908e-01 3.02415459e-01 3.02415459e-01 3.09178744e-01\n 3.09178744e-01 3.10144928e-01 3.10144928e-01 3.12077295e-01\n 3.12077295e-01 3.14975845e-01 3.14975845e-01 3.19806763e-01\n 3.19806763e-01 3.20772947e-01 3.20772947e-01 3.21739130e-01\n 3.21739130e-01 3.23671498e-01 3.23671498e-01 3.25603865e-01\n 3.25603865e-01 3.34299517e-01 3.34299517e-01 3.43961353e-01\n 3.43961353e-01 3.48792271e-01 3.48792271e-01 3.51690821e-01\n 3.51690821e-01 3.52657005e-01 3.52657005e-01 3.57487923e-01\n 3.57487923e-01 3.62318841e-01 3.62318841e-01 3.66183575e-01\n 3.66183575e-01 3.67149758e-01 3.67149758e-01 3.68115942e-01\n 3.68115942e-01 3.74879227e-01 3.74879227e-01 3.84541063e-01\n 3.84541063e-01 3.87439614e-01 3.87439614e-01 3.90338164e-01\n 3.90338164e-01 3.94202899e-01 3.94202899e-01 3.95169082e-01\n 3.95169082e-01 4.11594203e-01 4.11594203e-01 4.29951691e-01\n 4.29951691e-01 4.47342995e-01 4.47342995e-01 4.48309179e-01\n 4.48309179e-01 4.49275362e-01 4.49275362e-01 4.50241546e-01\n 4.50241546e-01 4.62801932e-01 4.62801932e-01 4.63768116e-01\n 4.63768116e-01 4.64734300e-01 4.64734300e-01 4.95652174e-01\n 4.95652174e-01 4.97584541e-01 4.97584541e-01 5.10144928e-01\n 5.10144928e-01 5.18840580e-01 5.18840580e-01 5.25603865e-01\n 5.25603865e-01 5.29468599e-01 5.29468599e-01 5.40096618e-01\n 5.40096618e-01 5.42028986e-01 5.42028986e-01 5.89371981e-01\n 5.89371981e-01 6.02898551e-01 6.02898551e-01 6.17391304e-01\n 6.17391304e-01 6.28019324e-01 6.28019324e-01 6.32850242e-01\n 6.32850242e-01 6.62801932e-01 6.62801932e-01 6.81159420e-01\n 6.81159420e-01 7.09178744e-01 7.09178744e-01 7.11111111e-01\n 7.11111111e-01 7.42028986e-01 7.42028986e-01 7.42995169e-01\n 7.42995169e-01 8.70531401e-01 8.70531401e-01 9.50724638e-01\n 9.50724638e-01 9.72946860e-01 9.72946860e-01 1.00000000e+00]",
      "tpr": "[0.         0.0026738  0.01604278 0.01604278 0.03475936 0.03475936\n 0.07219251 0.07219251 0.09893048 0.09893048 0.10160428 0.10160428\n 0.12566845 0.12566845 0.13101604 0.13101604 0.19251337 0.19251337\n 0.22459893 0.22459893 0.24331551 0.24331551 0.2513369  0.2513369\n 0.2540107  0.2540107  0.25668449 0.25668449 0.27272727 0.27272727\n 0.28074866 0.28074866 0.30213904 0.30213904 0.31550802 0.31550802\n 0.32887701 0.32887701 0.3368984  0.3368984  0.34491979 0.34491979\n 0.34759358 0.34759358 0.35026738 0.35026738 0.35828877 0.35828877\n 0.36363636 0.36363636 0.36898396 0.36898396 0.37433155 0.37433155\n 0.39304813 0.39304813 0.39572193 0.39572193 0.40106952 0.40106952\n 0.40374332 0.40374332 0.40641711 0.40641711 0.40909091 0.40909091\n 0.41176471 0.41176471 0.4171123  0.4171123  0.42245989 0.42245989\n 0.43048128 0.43048128 0.43850267 0.43850267 0.44117647 0.44117647\n 0.44385027 0.44385027 0.44919786 0.44919786 0.45989305 0.45989305\n 0.47326203 0.47326203 0.47593583 0.47593583 0.47860963 0.47860963\n 0.48663102 0.48663102 0.48930481 0.48930481 0.4973262  0.4973262\n 0.5026738  0.5026738  0.50534759 0.50534759 0.51604278 0.51604278\n 0.52139037 0.52139037 0.52673797 0.52673797 0.53208556 0.53208556\n 0.54278075 0.54278075 0.54545455 0.54545455 0.54812834 0.54812834\n 0.55080214 0.55080214 0.55614973 0.55614973 0.55882353 0.55882353\n 0.56951872 0.56951872 0.57219251 0.57219251 0.57754011 0.57754011\n 0.5828877  0.5828877  0.5855615  0.5855615  0.59625668 0.59625668\n 0.59893048 0.59893048 0.60160428 0.60160428 0.60427807 0.60427807\n 0.60962567 0.60962567 0.61764706 0.61764706 0.62299465 0.62299465\n 0.64171123 0.64171123 0.64438503 0.64438503 0.64705882 0.64705882\n 0.64973262 0.64973262 0.65240642 0.65240642 0.65508021 0.65508021\n 0.65775401 0.65775401 0.66042781 0.66042781 0.6631016  0.6631016\n 0.6657754  0.6657754  0.6684492  0.6684492  0.67112299 0.67112299\n 0.67379679 0.67379679 0.67647059 0.67647059 0.67914439 0.67914439\n 0.68181818 0.68181818 0.68449198 0.68449198 0.68983957 0.68983957\n 0.69251337 0.69251337 0.69518717 0.69518717 0.70053476 0.70053476\n 0.71390374 0.71390374 0.71925134 0.71925134 0.72192513 0.72192513\n 0.72459893 0.72459893 0.72727273 0.72727273 0.72994652 0.72994652\n 0.73262032 0.73262032 0.73529412 0.73529412 0.74064171 0.74064171\n 0.74331551 0.74331551 0.7459893  0.7459893  0.7486631  0.7486631\n 0.75668449 0.75668449 0.75935829 0.75935829 0.76203209 0.76203209\n 0.76470588 0.76470588 0.77005348 0.77005348 0.77272727 0.77272727\n 0.77540107 0.77540107 0.78074866 0.78074866 0.78342246 0.78342246\n 0.78609626 0.78609626 0.78877005 0.78877005 0.79144385 0.79144385\n 0.79411765 0.79411765 0.79679144 0.79679144 0.79946524 0.79946524\n 0.80481283 0.80481283 0.81016043 0.81016043 0.81283422 0.81283422\n 0.81550802 0.81550802 0.81818182 0.81818182 0.82352941 0.82352941\n 0.82620321 0.82620321 0.82887701 0.82887701 0.8315508  0.8315508\n 0.8342246  0.8342246  0.8368984  0.8368984  0.83957219 0.83957219\n 0.84224599 0.84224599 0.84759358 0.84759358 0.85026738 0.85026738\n 0.85294118 0.85294118 0.85561497 0.85561497 0.86096257 0.86096257\n 0.86631016 0.86631016 0.86898396 0.86898396 0.87165775 0.87165775\n 0.87433155 0.87433155 0.87700535 0.87700535 0.87967914 0.87967914\n 0.88235294 0.88235294 0.88770053 0.88770053 0.89037433 0.89037433\n 0.89304813 0.89304813 0.89572193 0.89572193 0.89839572 0.89839572\n 0.90106952 0.90106952 0.90374332 0.90374332 0.90641711 0.90641711\n 0.90909091 0.90909091 0.91176471 0.91176471 0.9144385  0.9144385\n 0.9171123  0.9171123  0.9197861  0.9197861  0.92245989 0.92245989\n 0.92513369 0.92513369 0.92780749 0.92780749 0.93048128 0.93048128\n 0.93315508 0.93315508 0.93582888 0.93582888 0.93850267 0.93850267\n 0.94117647 0.94117647 0.94385027 0.94385027 0.94652406 0.94652406\n 0.94919786 0.94919786 0.95187166 0.95187166 0.95454545 0.95454545\n 0.95721925 0.95721925 0.95989305 0.95989305 0.96256684 0.96256684\n 0.96524064 0.96524064 0.96791444 0.96791444 0.97058824 0.97058824\n 0.97326203 0.97326203 0.97593583 0.97593583 0.97860963 0.97860963\n 0.98128342 0.98128342 0.98395722 0.98395722 0.98663102 0.98663102\n 0.98930481 0.98930481 0.99197861 0.99197861 0.99465241 0.99465241\n 0.9973262  0.9973262  1.         1.        ]",
      "auc": 0.8591852024077089,
      "precision": "[0.26543648 0.265625   0.26581379 ... 1.         1.         1.        ]",
      "recall": "[1.         1.         1.         ... 0.00534759 0.0026738  0.        ]",
      "pr_auc": 0.7024130974980064,
      "cv_auc_mean": 0.8390846783469504,
      "cv_auc_std": 0.018353077853242732,
      "feature_importance": "                  feature  importance\n27      is_month_to_month    0.209454\n15               Contract    0.181218\n31       churn_risk_score    0.142696\n22   tenure_monthly_ratio    0.032160\n9          OnlineSecurity    0.026996\n12            TechSupport    0.022066\n8         InternetService    0.017756\n5                  tenure    0.017232\n25           has_internet    0.016902\n21          tenure_to_max    0.016228\n20           tenure_group    0.016057\n6            PhoneService    0.015673\n33          tenure_zscore    0.015587\n14        StreamingMovies    0.015337\n34  MonthlyCharges_zscore    0.014350\n18         MonthlyCharges    0.014337\n26              has_phone    0.014204\n32   SeniorCitizen_zscore    0.013654\n29              is_senior    0.013552\n23           charge_group    0.012941\n16       PaperlessBilling    0.012769\n11       DeviceProtection    0.012238\n2           SeniorCitizen    0.012115\n30         has_dependents    0.011887\n7           MultipleLines    0.011813\n4              Dependents    0.011511\n19           TotalCharges    0.011442\n35    TotalCharges_zscore    0.011411\n17          PaymentMethod    0.011174\n0              customerID    0.010808\n10           OnlineBackup    0.010343\n24         total_services    0.009410\n3                 Partner    0.008834\n13            StreamingTV    0.008670\n28   is_automatic_payment    0.008614\n1                  gender    0.008562"
    }
  }
]

README.md

## XGBoost

Test classification performance:
- No churn: precision **0.9126**, recall **0.7565**, F1-score **0.8273**
- Churn: precision **0.5426**, recall **0.7995**, F1-score **0.6465**